<!ELEMENT employees (employee+)>
<!ELEMENT employee (id, name, department, designation, email, salary)>
<!ELEMENT id (#PCDATA)>
<!ELEMENT name (#PCDATA)>
<!ELEMENT department (#PCDATA)>
<!ELEMENT designation (#PCDATA)>
<!ELEMENT email (#PCDATA)>
<!ELEMENT salary (#PCDATA)>
